{
  "spec_version": "ocm-run-3-bauspar-U01-v1",
  "emitted_utc": "2026-09-22T00:00:00Z",
  "author_role": "source_agent",
  "barrier_scan": {
    "scanned": true,
    "patterns_hit": 0,
    "leak_injection_validated": true
  },
  "io_formats": [
    {
      "input": "contract table handed to the unit (in the source's own session, the enriched merged contract table; the run's stand-in is the staged file below)",
      "expectations": [
        {
          "fact": "The unit reads exactly these eleven named fields from a contract row and no others: BSV, DaBetrag, Tilgungsbeginn, Vertragsende, abschlussdatum, bausparsumme_teuro, contract_type, einloesungsdatum, erstmalige_zuteilungsanwartschaft, guthaben, tariff_amount.",
          "provenance": "source_code_declared",
          "note": "Established twice over and in agreement: a mechanical parse of the unit's field accesses, and the controller's independent scan recorded as run finding F3. Stated here as VALUES in this order, never as a count (R3) -- this is the vector class that cost run 2 its only divergence. These names are what the unit DEMANDS; they are not evidence that a real table supplies them (run assumption UA-01)."
        },
        {
          "fact": "Any further field in the table is ignored. The unit selects the eleven it needs by name.",
          "provenance": "source_code_declared",
          "note": "Scope for R7 is the facts the computation depends on. A surplus field is a reported difference, never a halt (lessons finding 4)."
        },
        {
          "fact": "The identifier field BSV must be present: the browser-data writer stops with a named refusal when it is absent, and the single-contract inspector does the same.",
          "provenance": "source_code_declared"
        },
        {
          "fact": "Each of the five date-bearing fields may arrive either already typed as a date or as text holding eight digits in year-month-day order; both are handled, and the unit's comment names abschlussdatum and einloesungsdatum as typed and erstmalige_zuteilungsanwartschaft, Tilgungsbeginn and Vertragsende as raw digits.",
          "provenance": "source_code_declared",
          "note": "The split between the two forms comes from the unit's header comment only. Comments are not evidence (R1) and no real table was available to check it; recorded as the run's unverified assumption UA-02. The CODE handles either form for any of the five, and that is what must be implemented."
        },
        {
          "fact": "Each of the four amount-bearing fields may arrive either as a number or as text in German decimal-comma style, optionally with thousands dots.",
          "provenance": "source_code_declared"
        },
        {
          "fact": "The tariff share may be absent or missing for a contract; the unit records that as the goal source fallback_no_tariff and uses 0.40 instead.",
          "provenance": "source_code_declared"
        },
        {
          "fact": "Non-missing tariff shares are fractions of one, not percent points.",
          "provenance": "assumption",
          "note": "Run assumption UA-03. Inferred from the unit's arithmetic, not observed in any real table. Finding FND-02 states the consequence if it is false."
        },
        {
          "fact": "Contract identifiers are unique per row.",
          "provenance": "assumption",
          "note": "Run assumption UA-04, and it is doubtful: the downstream quality harness deliberately takes the FIRST row for an identifier, which implies duplicates are expected in the real table. The canonical order declared for every checkpoint object therefore carries a second key so that it stays total if identifiers repeat."
        }
      ]
    },
    {
      "input": "merged_data_synthetic.csv (staged stand-in, generated; NOT a real input)",
      "expectations": [
        {
          "fact": "The real contract table is absent from the bundle, so every fact in this block was observed in a generated stand-in and none of them is evidence about production data. Under R2 this caps the run's verdict at PROVISIONAL however well the two sides agree.",
          "provenance": "assumption",
          "note": "Run finding F1. Named here so the cap is stated, not inferred."
        },
        {
          "fact": "503 data rows and one header row; exactly eleven comma-delimited fields on every line under proper quoting; UTF-8; the eleven header names are the eleven of input_column_catalogue.",
          "provenance": "observed_in_synthetic_input"
        },
        {
          "fact": "103 of the 503 data lines carry quoted fields containing commas. A reader that splits the line on commas instead of parsing quoted fields sees 14 or 15 fields on those lines and mis-assigns every field after the first amount, silently.",
          "provenance": "observed_in_synthetic_input",
          "note": "The controller's own profiler made exactly this mistake and reported the file as ragged (run finding F7). Carried across as a hazard to verify, not as a setting to adopt (R7)."
        },
        {
          "fact": "Distinct tariff share values in full: 0,3000 / 0,3500 / 0,4000 / 0,5000 / 0.3 / 0.35 / 0.4 / 0.5 / NA. 89 of 503 rows carry the missing marker. Values run from 0.3 to 0.5 once read.",
          "provenance": "observed_in_synthetic_input",
          "note": "Values in full rather than a count (R3). Both the plain and the decimal-comma spellings occur, so both branches of the number reader are exercised."
        },
        {
          "fact": "Distinct contract type values in full: the empty text, BS1, BS2, BSK, VL7. 83 of 503 rows carry the empty text.",
          "provenance": "observed_in_synthetic_input"
        },
        {
          "fact": "Observed ranges in the stand-in, after reading: identifiers 800000 to 900023; DaBetrag 0 to 295982.79 with 2 missing; bausparsumme_teuro 0 to 50.972 with 3 missing, in thousands of euro; guthaben 318.53 to 216706.84 with none missing; parsed dates from 1998-01-04 to 2043-10-15.",
          "provenance": "observed_in_synthetic_input",
          "note": "Ranges, not shapes (R3). The maximum of bausparsumme_teuro is about 51, which is the thousands-of-euro unit showing itself: a reader that failed to apply the factor of 1000 would put the whole book in the bridge-loan band, which is what precondition P-13 tests."
        },
        {
          "fact": "The missing markers actually present in the stand-in's date fields are the empty text, 0, 00000000 and NA. The unit recognises seven markers; three of them are not exercised here.",
          "provenance": "observed_in_synthetic_input",
          "note": "An honest statement of what the stand-in does and does not cover. See finding FND-11."
        },
        {
          "fact": "The stand-in is delivered as text throughout. The source-side harness coerces exactly two fields, abschlussdatum and einloesungsdatum, to a date type before the unit sees them, and leaves erstmalige_zuteilungsanwartschaft, Tilgungsbeginn and Vertragsende as raw digits, so that both branches of the date reader are exercised. The coercion is declared in the stand-in's manifest and is applied identically on both sides; neither side infers it.",
          "provenance": "observed_in_synthetic_input"
        },
        {
          "fact": "Identifiers are unique in the stand-in by construction, so the stand-in cannot exercise the duplicate-identifier path of finding FND-04.",
          "provenance": "observed_in_synthetic_input"
        }
      ]
    }
  ],
  "units": [
    {
      "id": "U01",
      "name": "customer lifecycle engine for a single Bauspar contract",
      "reads": [
        "contract table handed to the unit (the eleven fields of input_column_catalogue)",
        "valuation date (supplied by the caller; the unit's own default is in the constants)"
      ],
      "produces": [
        "customer_book",
        "customer_export_rows",
        "customers_js_document"
      ],
      "behavior": [
        "L1. LOAD. Bringing the unit into a session defines thirteen named routines and creates no other value: a date reader, a year-label maker, a clamp, a German-number reader, the per-contract calculation, a whole-book calculation, an export-name mapper, a scalar-to-script renderer, a record-to-script renderer, a progress-indicator builder, the browser-data writer, a single-contract inspector and a standalone-page writer. Nothing else is evaluated at load except the three-way branch in L2. Verified by loading the unit in an empty session and listing what appeared; the unit's own header comments were not used as evidence (R1).",
        "L2. LOAD, continued. Exactly one of three branches then runs, chosen by what already exists in the calling session. (a) If a value named merged_data_with_tariff_amount exists, the browser-data writer runs immediately over it and writes the file customers_data.js into the process working directory, at the valuation date held in a session value named VAL_DATE when that name exists and otherwise at 2026-03-31. (b) Otherwise, if a value named merged_data exists, a warning is raised on the diagnostic stream saying the enriched table was not found and that contract_type and goal_frac will be empty, and the same writer then runs over that table on the same date rule. (c) Otherwise a two-line notice is printed on the diagnostic stream, naming the unit and the call that would produce the data file; nothing is computed and nothing is written. Branch (c) is the branch a clean load takes, and it is what the source-side harness observed: two lines on the diagnostic stream, no file, no computation.",
        "L3. In branches (a) and (b) the load also leaves behind one extra session value holding the valuation date it used. This is a side effect of loading, not a published object.",